{
  "nino": "GW629902A",
  "gender": "MALE",
  "entryDate": "10-10-2020",
  "birthDate": "10-10-2020",
  "officeNumber": "1234",
  "names": [
    {
      "nameType": "REGISTERED",
      "surname": "ASurname"
    }
  ],
  "addresses": [
    {
      "addressType": "RESIDENTIAL",
      "line1": "4 AStreetName",
      "countryCode": "NGA"
    }
  ]
}


